Title, Company, Location, URL
Front-end Developer의 전체 세부 정보, 크래프트테크놀로지스, 서울 영등포구,https://kr.indeed.com/rc/clk?jk=baac449478aa1d96&fccid=2775f62c77fd9b9e&vjs=3
웹 프론트엔드 엔지니어의 전체 세부 정보, 뱅크샐러드, 서울 영등포구,https://kr.indeed.com/rc/clk?jk=8a69b59eaffabb56&fccid=35209469e1b8c72c&vjs=3
Pala Backend engineer 경력 정규직의 전체 세부 정보, 팔라, 성남 분당구,https://kr.indeed.com/rc/clk?jk=a86294dbdeecdf94&fccid=62086f4e9fd74de9&vjs=3
[위메프서비스] 프론트엔드 개발자의 전체 세부 정보, 위메프, 대한민국,https://kr.indeed.com/rc/clk?jk=cd4215f2e3c50f03&fccid=2f8799a5ef214646&vjs=3
Front End Developer, BrickSeek, ?? Worldwide,https://remoteok.com/remote-jobs/110607-remote-front-end-developer-brickseek
